{
  "response_schema_version": "bankroll_response_batch.v1.9",
  "bank_policy_version": "bank_policy.v1.9",
  "decision_batch_id": "bank_batch_2026_03_23_001",
  "selector_run_id": "gps_run_2026_03_23_001",
  "decision_timestamp": "2026-03-23T20:17:00Z",
  "decisions": [
    {
      "bank_schema_version": "bank_decision.v1.1",
      "decision_id": "bank_001",
      "pick_id": "v12_20260323_001",
      "module_origin": "v12",
      "event_id": 991100,
      "match_label": "Roma vs Lecce",
      "market_family": "goals",
      "market": "match_under",
      "selection": "Under 3.5 Goals",
      "line": 3.5,
      "priority_tier": "Best",
      "global_score": 88,
      "decision_status": "APPROVED",
      "stake_base": 1.25,
      "stake_suggested": 1.25,
      "stake_approved": 1.25,
      "stake_pct_bankroll": 2.0,
      "bank_state_mode": "Normal",
      "portfolio_group": "core",
      "exposure_bucket": "day_low",
      "execution_order": 1,
      "approved_odds_window": "1.58-1.66",
      "execution_ready": true,
      "rules_triggered": [],
      "block_reason_code": null,
      "block_reason_text": null,
      "decision_timestamp": "2026-03-23T20:17:00Z",
      "bankroll_note": "Entrada plena por prioridade Best e ausência de conflitos."
    },
    {
      "bank_schema_version": "bank_decision.v1.1",
      "decision_id": "bank_002",
      "pick_id": "corners_20260323_004",
      "module_origin": "corners",
      "event_id": 878317,
      "match_label": "Osasuna vs Girona",
      "market_family": "corners",
      "market": "match_corners_under",
      "selection": "Under 10.5 Corners",
      "line": 10.5,
      "priority_tier": "Top",
      "global_score": 84,
      "decision_status": "APPROVED_REDUCED",
      "stake_base": 1.0,
      "stake_suggested": 1.0,
      "stake_approved": 0.75,
      "stake_pct_bankroll": 1.2,
      "bank_state_mode": "Alerta",
      "portfolio_group": "satellite",
      "exposure_bucket": "day_medium",
      "execution_order": 3,
      "approved_odds_window": "1.83-1.95",
      "execution_ready": true,
      "rules_triggered": [
        "REDUCE_PARTIAL_CORRELATION",
        "REDUCE_BANK_ALERT"
      ],
      "block_reason_code": null,
      "block_reason_text": null,
      "decision_timestamp": "2026-03-23T20:17:00Z",
      "bankroll_note": "Corte preventivo por correlação parcial e estado Alerta."
    },
    {
      "bank_schema_version": "bank_decision.v1.1",
      "decision_id": "bank_003",
      "pick_id": "btts_20260323_002",
      "module_origin": "btts",
      "event_id": 991100,
      "match_label": "Roma vs Lecce",
      "market_family": "btts",
      "market": "btts_no",
      "selection": "BTTS No",
      "line": null,
      "priority_tier": "Actionable",
      "global_score": 79,
      "decision_status": "BLOCKED",
      "stake_base": 0.75,
      "stake_suggested": 0.75,
      "stake_approved": 0.0,
      "stake_pct_bankroll": null,
      "bank_state_mode": "Normal",
      "portfolio_group": "optional",
      "exposure_bucket": "fixture_locked",
      "execution_order": null,
      "approved_odds_window": null,
      "execution_ready": false,
      "rules_triggered": [
        "BLOCK_DUPLICATE_FIXTURE"
      ],
      "block_reason_code": "BLOCK_DUPLICATE_FIXTURE",
      "block_reason_text": "Fixture já ocupada por pick previamente aprovada.",
      "decision_timestamp": "2026-03-23T20:17:00Z",
      "bankroll_note": "Bloqueio estrutural por regra de fixture única."
    },
    {
      "bank_schema_version": "bank_decision.v1.1",
      "decision_id": "bank_004",
      "pick_id": "cards_20260323_006",
      "module_origin": "cards",
      "event_id": 778899,
      "match_label": "Portimonense vs Braga",
      "market_family": "cards",
      "market": "match_cards_over",
      "selection": "Over 4.5 Cards",
      "line": 4.5,
      "priority_tier": "Watchlist",
      "global_score": 73,
      "decision_status": "RESERVE",
      "stake_base": 0.5,
      "stake_suggested": 0.5,
      "stake_approved": 0.0,
      "stake_pct_bankroll": null,
      "bank_state_mode": "Normal",
      "portfolio_group": "optional",
      "exposure_bucket": "day_medium",
      "execution_order": null,
      "approved_odds_window": null,
      "execution_ready": false,
      "rules_triggered": [
        "REDUCE_DAY_EXPOSURE"
      ],
      "block_reason_code": null,
      "block_reason_text": null,
      "decision_timestamp": "2026-03-23T20:17:00Z",
      "bankroll_note": "Mantida em reserva por tier Watchlist e contexto operacional."
    }
  ]
}